{
  "$schema": "https://github.com/christopherlouet/claude-base/blob/main/specs/presets/schema.json",
  "name": "nextjs",
  "displayName": "Next.js full-stack",
  "description": "Next.js (App Router) + React + TypeScript. The foundation rules and workflow are kept; clearly other-stack themes (Flutter, Proxmox, OPNsense, mobile release, infra-as-code, data pipeline) are simply not opted into — they live in thematic modules this preset does not request. Bundles ZERO marketplace plugins at v1 — plugin curation is added incrementally as each one is validated in real production use, not assumed. Auth, ORM, deploy and payment patterns are decisions left to the developer; see docs/recipes/saas-monetization.md if a subscription model is needed.",
  "version": "1.5.0",
  "status": "maintainer-vouched",
  "author": {
    "name": "Chris",
    "github": "christopherlouet"
  },
  "defaultModules": [
    "api-data",
    "frontend",
    "nextjs"
  ],
  "appliesToTypes": [
    "react",
    "fullstack"
  ],
  "detect": {
    "combinator": "anyOf",
    "files": [
      "next.config.js",
      "next.config.mjs",
      "next.config.ts"
    ],
    "depFiles": [
      {
        "path": "package.json",
        "contains": "\"next\""
      }
    ]
  },
  "foundation": {},
  "marketplacePlugins": [],
  "recommendedVendorSkills": [
    {
      "id": "vercel-labs/agent-skills",
      "url": "https://github.com/vercel-labs/agent-skills",
      "rationale": "Canonical react-best-practices and Next.js patterns from Vercel Engineering",
      "condition": "always",
      "pinnedRef": "1a2c79d4e6c4a2283dc2c614b6538cbe1ed5ca62",
      "trustTrack": "authority",
      "provenance": "Vercel",
      "lastVerified": "2026-10-30"
    },
    {
      "id": "frontend-design@claude-plugins-official",
      "url": "https://claude.com/plugins/frontend-design",
      "rationale": "Anthropic's official UI design plugin (avoid generic Inter+purple aesthetic)",
      "condition": "always",
      "pinnedRef": "536a2e23d9e28586f81f17b3535281b5f2995a70",
      "trustTrack": "authority",
      "provenance": "Anthropic",
      "lastVerified": "2026-09-11"
    },
    {
      "id": "supabase/agent-skills",
      "url": "https://github.com/supabase/agent-skills",
      "rationale": "Auth, DB, Edge Functions, Realtime, Storage patterns + Postgres best practices",
      "condition": "if using Supabase",
      "pinnedRef": "v0.1.9",
      "trustTrack": "authority",
      "provenance": "Supabase",
      "lastVerified": "2026-10-03"
    },
    {
      "id": "prisma/skills",
      "url": "https://github.com/prisma/skills",
      "rationale": "Prisma ORM patterns, especially v7 (ESM-only, driver adapters)",
      "condition": "if using Prisma",
      "pinnedRef": "8ea289b730c2e89f7ff1f518af128b113d842a92",
      "trustTrack": "authority",
      "provenance": "Prisma",
      "lastVerified": "2026-10-30"
    },
    {
      "id": "shadcn-ui/ui (skills/shadcn)",
      "url": "https://github.com/shadcn-ui/ui/tree/main/skills/shadcn",
      "rationale": "shadcn/ui CLI v4, Radix + Base UI primitives, theming patterns",
      "condition": "if using shadcn/ui",
      "pinnedRef": "shadcn@4.23.0",
      "trustTrack": "authority",
      "provenance": "shadcn",
      "lastVerified": "2026-10-30"
    },
    {
      "id": "apollographql/skills",
      "url": "https://github.com/apollographql/skills",
      "rationale": "Apollo Client, Apollo Server 5, Federation 2",
      "condition": "if using Apollo GraphQL",
      "pinnedRef": "v1.2.12",
      "trustTrack": "authority",
      "provenance": "Apollo GraphQL",
      "lastVerified": "2026-10-03"
    }
  ],
  "defaults": {
    "ci": true,
    "hooks": true,
    "mcp": false,
    "docker": false,
    "designStyle": "editorial"
  },
  "outOfScope": [
    "Payment processing — see docs/recipes/saas-monetization.md if subscription/billing is needed",
    "Native mobile companion — use a Flutter or Swift preset (community contributions wanted)",
    "Backend in non-Node languages — see roadmap for Django, FastAPI, Rails, Laravel, etc.",
    "Vendor-specific React/Next.js patterns — pair this preset with the vendor skill at vercel-labs/agent-skills (react-best-practices) for canonical Vercel guidance; see specs/marketplace-audit/dev-skills-pilot-2026-05-05.md"
  ],
  "categories": [
    "web-frontend",
    "api-backend"
  ],
  "relatedPresetsWanted": [
    "astro",
    "sveltekit",
    "vue-nuxt",
    "django",
    "fastapi",
    "rails",
    "laravel"
  ]
}
