{
  "$schema": "https://github.com/christopherlouet/claude-base/blob/main/specs/presets/schema.json",
  "name": "homelab-proxmox",
  "displayName": "Proxmox VE homelab",
  "description": "Proxmox VE + Terraform + Ansible + monitoring (Prometheus/Grafana). Targets sysadmins running infrastructure-as-code on a personal or small-team Proxmox cluster. Filters out app/UI/mobile-only skills (React, Next.js, Flutter, mobile-release, frontend-design, conversion optimization). Bundles ZERO marketplace plugins at v1 — Terraform-specific plugins will be added incrementally as they are validated in real production use. Rules from the foundation are path-gated (react.md activates on .tsx files only, etc.) so they remain inert on a Terraform/Ansible repo.",
  "version": "1.2.0",
  "status": "maintainer-vouched",
  "author": {
    "name": "Chris",
    "github": "christopherlouet"
  },
  "defaultModules": [
    "self-hosted",
    "iac",
    "observability"
  ],
  "appliesToTypes": [
    "generic"
  ],
  "detect": {
    "combinator": "anyOf",
    "depFiles": [
      {
        "path": "main.tf",
        "contains": "telmate/proxmox"
      },
      {
        "path": "main.tf",
        "contains": "bpg/proxmox"
      },
      {
        "path": "providers.tf",
        "contains": "telmate/proxmox"
      },
      {
        "path": "providers.tf",
        "contains": "bpg/proxmox"
      },
      {
        "path": "terraform.tf",
        "contains": "telmate/proxmox"
      },
      {
        "path": "terraform.tf",
        "contains": "bpg/proxmox"
      },
      {
        "path": "versions.tf",
        "contains": "telmate/proxmox"
      },
      {
        "path": "versions.tf",
        "contains": "bpg/proxmox"
      }
    ]
  },
  "foundation": {},
  "marketplacePlugins": [],
  "recommendedVendorSkills": [
    {
      "id": "antonbabenko/terraform-skill",
      "url": "https://github.com/antonbabenko/terraform-skill",
      "rationale": "Comprehensive Terraform/OpenTofu patterns (the de-facto community skill)",
      "condition": "always (Terraform is core to this preset)",
      "pinnedRef": "v1.17.2",
      "trustTrack": "community",
      "provenance": "Anton Babenko (community)",
      "lastVerified": "2026-10-30"
    },
    {
      "id": "pulumi/agent-skills",
      "url": "https://github.com/pulumi/agent-skills",
      "rationale": "Pulumi authoring + migration workflows (Terraform→Pulumi)",
      "condition": "if using Pulumi instead of Terraform",
      "pinnedRef": "82f222a529a499e8005a820000148cc5e28c934c",
      "trustTrack": "authority",
      "provenance": "Pulumi",
      "lastVerified": "2026-10-31"
    },
    {
      "id": "grafana/skills",
      "url": "https://github.com/grafana/skills",
      "rationale": "Grafana, LGTM stack for monitoring and observability",
      "condition": "if using Grafana / Prometheus stack",
      "pinnedRef": "8fb72a527961f05e708f53d2a0500709e12d7970",
      "trustTrack": "authority",
      "provenance": "Grafana Labs",
      "lastVerified": "2026-10-30"
    },
    {
      "id": "homeassistant-ai/skills (skills/home-assistant-best-practices)",
      "url": "https://github.com/homeassistant-ai/skills/tree/main/skills/home-assistant-best-practices",
      "rationale": "Idiomatic Home Assistant configuration: native triggers over templates, entity_id over device_id, automation modes",
      "condition": "if the project holds a Home Assistant configuration",
      "pinnedRef": "166defa51c606b3c77d45a9b29a459d1f993f357",
      "trustTrack": "community",
      "provenance": "homeassistant-ai (community — the official Home Assistant org publishes no skills)",
      "lastVerified": "2026-10-30"
    }
  ],
  "defaults": {
    "ci": true,
    "hooks": true,
    "mcp": false,
    "docker": false,
    "designStyle": "cockpit"
  },
  "outOfScope": [
    "Application development (use the nextjs preset or a backend-language preset)",
    "Mobile companions (use a flutter or swift preset — community contributions wanted)",
    "Cloud infrastructure beyond Proxmox/OPNsense — see roadmap for AWS, GCP, Azure presets"
  ],
  "categories": [
    "infra-devops"
  ],
  "relatedPresetsWanted": [
    "homelab-truenas",
    "homelab-unraid",
    "ops-aws-terraform",
    "ops-gcp-terraform",
    "ops-azure-bicep",
    "ops-kubernetes-bare"
  ]
}
