{
  "$schema": "https://github.com/christopherlouet/claude-base/blob/main/specs/presets/schema.json",
  "name": "react-vite-spa",
  "displayName": "React Vite SPA",
  "description": "React + Vite + React Router for Single-Page Applications. Targets SPAs without SSR/RSC: client-rendered apps, PWAs, and Capacitor-wrapped mobile shells. Keeps the full frontend toolkit (shadcn, react-perf, i18n, auth, graphql) and filters out server-centric, homelab, and mobile-native skills. Not the right preset for SSR/RSC (use `nextjs`), static-content sites (use `astro`), or native mobile distribution beyond a Capacitor wrap.",
  "version": "1.2.0",
  "status": "maintainer-vouched",
  "author": {
    "name": "Chris",
    "github": "christopherlouet"
  },
  "defaultModules": [
    "api-data",
    "frontend"
  ],
  "appliesToTypes": [
    "react",
    "fullstack"
  ],
  "detect": {
    "combinator": "allOf",
    "files": [
      "vite.config.*"
    ],
    "depFiles": [
      {
        "path": "package.json",
        "contains": "\"react-router-dom\""
      }
    ]
  },
  "foundation": {},
  "marketplacePlugins": [],
  "recommendedVendorSkills": [
    {
      "id": "vercel-labs/agent-skills",
      "url": "https://github.com/vercel-labs/agent-skills",
      "rationale": "Canonical React patterns from Vercel Engineering (valid outside Next.js for SPA work)",
      "condition": "always",
      "pinnedRef": "1a2c79d4e6c4a2283dc2c614b6538cbe1ed5ca62",
      "trustTrack": "authority",
      "provenance": "Vercel",
      "lastVerified": "2026-10-30"
    },
    {
      "id": "frontend-design@claude-plugins-official",
      "url": "https://claude.com/plugins/frontend-design",
      "rationale": "Anthropic's official UI design plugin (avoid generic Inter+purple aesthetic)",
      "condition": "always",
      "pinnedRef": "536a2e23d9e28586f81f17b3535281b5f2995a70",
      "trustTrack": "authority",
      "provenance": "Anthropic",
      "lastVerified": "2026-09-11"
    },
    {
      "id": "shadcn-ui/ui (skills/shadcn)",
      "url": "https://github.com/shadcn-ui/ui/tree/main/skills/shadcn",
      "rationale": "shadcn/ui CLI v4, Radix + Base UI primitives, theming patterns",
      "condition": "if using shadcn/ui",
      "pinnedRef": "shadcn@4.23.0",
      "trustTrack": "authority",
      "provenance": "shadcn",
      "lastVerified": "2026-10-30"
    },
    {
      "id": "lingui/skills",
      "url": "https://github.com/lingui/skills",
      "rationale": "Lingui i18n patterns for React (sourced from specs/marketplace-audit/dev-skills-pilot)",
      "condition": "if using Lingui for i18n",
      "pinnedRef": "3420ebbda26812155bfc121d5d02c9bd345a7d92",
      "trustTrack": "authority",
      "provenance": "Lingui",
      "lastVerified": "2026-10-30"
    }
  ],
  "defaults": {
    "ci": true,
    "hooks": true,
    "mcp": false,
    "docker": false,
    "designStyle": "editorial"
  },
  "outOfScope": [
    "Server-side rendering or React Server Components — use the `nextjs` preset",
    "Static-content / blog / marketing sites — use the `astro` preset",
    "Native mobile distribution beyond a Capacitor wrap — community contributions wanted for `flutter`, `swift`, `react-native`",
    "Opinionated state management library choice (Redux/Zustand/Jotai) — the React community has not converged; preset stays neutral",
    "Opinionated data-fetching library choice (TanStack Query/SWR/Apollo) — preset stays neutral",
    "Build-tool alternatives (Rollup, esbuild, Rspack, Turbopack) — Vite is the explicit target"
  ],
  "categories": [
    "web-frontend"
  ],
  "relatedPresetsWanted": [
    "sveltekit",
    "vue-nuxt",
    "remix",
    "react-native"
  ]
}
