{
  "$schema": "https://github.com/christopherlouet/claude-base/blob/main/specs/presets/schema.json",
  "name": "astro",
  "displayName": "Astro content/static-first",
  "description": "Astro + TypeScript + Content Collections. Targets developers building content-heavy sites: marketing pages, documentation sites, blogs, landing pages. Astro's islands architecture lets users mix React/Vue/Svelte/Solid components selectively, so this preset keeps the broader frontend toolkit (`dev-frontend-design`, `dev-shadcn`, `dev-react-perf`, `qa-chrome`, `qa-design`) and only filters out clearly non-applicable skills (mobile, homelab, the Next.js framework specifically). Bundles ZERO marketplace plugins at v1 — Astro-specific plugin curation will be added incrementally as each one is validated in real production use, not assumed.",
  "version": "1.3.0",
  "status": "maintainer-vouched",
  "author": {
    "name": "Chris",
    "github": "christopherlouet"
  },
  "defaultModules": [
    "frontend"
  ],
  "appliesToTypes": [
    "astro",
    "fullstack"
  ],
  "detect": {
    "combinator": "anyOf",
    "files": [
      "astro.config.mjs",
      "astro.config.ts",
      "astro.config.js"
    ],
    "depFiles": [
      {
        "path": "package.json",
        "contains": "\"astro\""
      }
    ]
  },
  "foundation": {},
  "marketplacePlugins": [],
  "recommendedVendorSkills": [
    {
      "id": "vercel-labs/agent-skills",
      "url": "https://github.com/vercel-labs/agent-skills",
      "rationale": "react-best-practices (Vercel Engineering) for React islands within Astro",
      "condition": "if using React islands",
      "pinnedRef": "1a2c79d4e6c4a2283dc2c614b6538cbe1ed5ca62",
      "trustTrack": "authority",
      "provenance": "Vercel",
      "lastVerified": "2026-10-30"
    },
    {
      "id": "shadcn-ui/ui (skills/shadcn)",
      "url": "https://github.com/shadcn-ui/ui/tree/main/skills/shadcn",
      "rationale": "shadcn/ui patterns within Astro components",
      "condition": "if using shadcn/ui",
      "pinnedRef": "shadcn@4.23.0",
      "trustTrack": "authority",
      "provenance": "shadcn",
      "lastVerified": "2026-10-30"
    },
    {
      "id": "frontend-design@claude-plugins-official",
      "url": "https://claude.com/plugins/frontend-design",
      "rationale": "Anthropic's official UI design plugin (essential for content/marketing sites)",
      "condition": "always",
      "pinnedRef": "536a2e23d9e28586f81f17b3535281b5f2995a70",
      "trustTrack": "authority",
      "provenance": "Anthropic",
      "lastVerified": "2026-09-11"
    }
  ],
  "defaults": {
    "ci": true,
    "hooks": true,
    "mcp": false,
    "docker": false,
    "designStyle": "editorial"
  },
  "outOfScope": [
    "Native mobile companion — use a Flutter or Swift preset (community contributions wanted)",
    "Heavy SSR/full-stack backend logic — pair with the fastapi preset for a Python API, or use the nextjs preset if you need a JS-native fullstack with extensive server logic",
    "Homelab IaC — use the homelab-proxmox preset for Proxmox/Terraform/Ansible patterns",
    "Real-time / streaming apps — Astro excels at SSG and selective hydration; for heavy streaming UIs, SvelteKit or Next.js are better fits",
    "Toolchain choice (uv vs pdm vs pip, ruff vs flake8) — Python is rarely the primary stack for Astro, but if backend services are added see docs/recipes/python-toolchain-options.md",
    "i18n library-specific patterns — for Lingui-based content sites, pair this preset with lingui/skills (the official Lingui agent skill); see specs/marketplace-audit/dev-skills-pilot-2026-05-05.md"
  ],
  "categories": [
    "web-frontend"
  ],
  "relatedPresetsWanted": [
    "sveltekit",
    "vue-nuxt",
    "remix",
    "eleventy",
    "qwik"
  ]
}
