{
  "$schema": "https://github.com/christopherlouet/claude-base/blob/main/specs/presets/schema.json",
  "name": "fastapi",
  "displayName": "FastAPI backend (Python async)",
  "description": "FastAPI + Pydantic + SQLAlchemy/async ORM. Targets developers building HTTP APIs, LLM-backed services, or async data ingestion endpoints in Python. The foundation rules and workflow are kept; clearly non-applicable skills are filtered out: frontend-only stacks (Next.js, Shadcn, React perf, frontend design), mobile stacks (Flutter, mobile-release), homelab-specific ops (Proxmox, OPNsense), and UI-bound QA (Chrome, design, browser E2E). Skills that ARE kept and useful for backend work include `dev-api`, `dev-auth`, `dev-graphql`, `dev-supabase` (Python SDK), `ops-database`, `ops-docker`, `ops-monitoring`, `qa-perf`, `qa-security`. Bundles ZERO marketplace plugins at v1 — Python-specific plugin curation will be added incrementally as each one is validated in real production use, not assumed.",
  "version": "1.1.0",
  "status": "maintainer-vouched",
  "author": {
    "name": "Chris",
    "github": "christopherlouet"
  },
  "appliesToTypes": [
    "python",
    "generic"
  ],
  "detect": {
    "combinator": "anyOf",
    "depFiles": [
      {
        "path": "requirements.txt",
        "contains": "fastapi"
      },
      {
        "path": "pyproject.toml",
        "contains": "fastapi"
      },
      {
        "path": "Pipfile",
        "contains": "fastapi"
      }
    ]
  },
  "defaultModules": [
    "api-data"
  ],
  "foundation": {},
  "marketplacePlugins": [],
  "recommendedVendorSkills": [
    {
      "id": "supabase/agent-skills",
      "url": "https://github.com/supabase/agent-skills",
      "rationale": "Postgres best practices (30 rules) + Supabase Python SDK patterns",
      "condition": "if using Postgres or Supabase",
      "pinnedRef": "v0.1.9",
      "trustTrack": "authority",
      "provenance": "Supabase",
      "lastVerified": "2026-10-03"
    },
    {
      "id": "mongodb/agent-skills",
      "url": "https://github.com/mongodb/agent-skills",
      "rationale": "MongoDB schema design, indexing, query patterns, operational safeguards",
      "condition": "if using MongoDB",
      "pinnedRef": "v1.1.0",
      "trustTrack": "authority",
      "provenance": "MongoDB",
      "lastVerified": "2026-06-13"
    },
    {
      "id": "grafana/skills",
      "url": "https://github.com/grafana/skills",
      "rationale": "Grafana, LGTM stack (Loki/Tempo/Mimir), k6 perf testing",
      "condition": "if using Grafana / observability stack",
      "pinnedRef": "8fb72a527961f05e708f53d2a0500709e12d7970",
      "trustTrack": "authority",
      "provenance": "Grafana Labs",
      "lastVerified": "2026-10-30"
    },
    {
      "id": "antonbabenko/terraform-skill",
      "url": "https://github.com/antonbabenko/terraform-skill",
      "rationale": "Comprehensive Terraform/OpenTofu patterns",
      "condition": "if deploying via Terraform/OpenTofu",
      "pinnedRef": "v1.17.2",
      "trustTrack": "community",
      "provenance": "Anton Babenko (community)",
      "lastVerified": "2026-10-30"
    }
  ],
  "defaults": {
    "ci": true,
    "hooks": true,
    "mcp": false,
    "docker": true,
    "designStyle": "editorial"
  },
  "outOfScope": [
    "Frontend rendering — pair with the nextjs preset, or community presets for Astro/SvelteKit/Vue/Nuxt when shipped",
    "Mobile / desktop apps (community contributions wanted for flutter, swift, tauri)",
    "Authentication strategy choice — FastAPI has many viable patterns (JWT, OAuth2, fastapi-users, Authlib); the foundation does not pick one",
    "Container orchestration beyond docker-compose — Kubernetes patterns belong to a future k8s preset",
    "Backends in other languages — see roadmap for Django, Flask, Rails, Spring Boot, Gin, Axum",
    "Toolchain choice (uv vs pdm vs pip, ruff vs flake8, ty vs mypy) — see docs/recipes/python-toolchain-options.md for the three documented paths and the rationale for not bundling astral@astral-sh by default"
  ],
  "categories": [
    "api-backend"
  ],
  "relatedPresetsWanted": [
    "django",
    "flask",
    "rails",
    "laravel",
    "spring-boot",
    "gin",
    "axum",
    "kubernetes"
  ]
}
